{
  "created_at": "2026-06-29T00:00:00Z",
  "edges": [
    {
      "derived_from": {
        "source_artifact_ids": [
          "runtime-proposal-v0.9"
        ],
        "verifier_result_ids": [
          "runtime-proposal-verify"
        ]
      },
      "edge_id": "edge-001",
      "edge_type": "PROPOSED_BY",
      "from_node": "runtime-proposal-001",
      "to_node": "agent-001"
    },
    {
      "derived_from": {
        "source_artifact_ids": [
          "runtime-proposal-v0.9"
        ],
        "verifier_result_ids": [
          "runtime-proposal-verify"
        ]
      },
      "edge_id": "edge-002",
      "edge_type": "NORMALIZED_TO",
      "from_node": "runtime-proposal-001",
      "to_node": "consequence-001"
    },
    {
      "derived_from": {
        "source_artifact_ids": [
          "runtime-proposal-v0.9",
          "approved-decision-envelope-v0.3"
        ],
        "verifier_result_ids": [
          "runtime-proposal-verify",
          "decision-envelope-approval-binding-verify"
        ]
      },
      "edge_id": "edge-003",
      "edge_type": "CLASSIFIED_AS",
      "from_node": "consequence-001",
      "to_node": "decision-envelope-001"
    },
    {
      "derived_from": {
        "source_artifact_ids": [
          "runtime-proposal-v0.9"
        ],
        "verifier_result_ids": [
          "runtime-proposal-verify"
        ]
      },
      "edge_id": "edge-004",
      "edge_type": "HAS_EXECUTION_STATUS",
      "from_node": "runtime-proposal-001",
      "to_node": "consequence-001"
    },
    {
      "derived_from": {
        "source_artifact_ids": [
          "runtime-proposal-v0.9"
        ],
        "verifier_result_ids": [
          "runtime-proposal-verify"
        ]
      },
      "edge_id": "edge-005",
      "edge_type": "HAS_AUTHORIZATION_STATUS",
      "from_node": "runtime-proposal-001",
      "to_node": "consequence-001"
    },
    {
      "derived_from": {
        "source_artifact_ids": [
          "approved-decision-envelope-v0.3",
          "approval-token-v0.3"
        ],
        "verifier_result_ids": [
          "decision-envelope-approval-binding-verify"
        ]
      },
      "edge_id": "edge-006",
      "edge_type": "BOUND_TO",
      "from_node": "decision-envelope-001",
      "to_node": "approval-token-001"
    },
    {
      "derived_from": {
        "source_artifact_ids": [
          "approval-token-v0.3",
          "reviewer-authority-manifest-v0.3"
        ],
        "verifier_result_ids": [
          "reviewer-authority-binding-verify"
        ]
      },
      "edge_id": "edge-007",
      "edge_type": "AUTHORIZED_BY",
      "from_node": "approval-token-001",
      "to_node": "reviewer-authority-001"
    },
    {
      "derived_from": {
        "source_artifact_ids": [
          "evidence-bound-decision-envelope-v0.4",
          "evidence-manifest-v0.4"
        ],
        "verifier_result_ids": [
          "evidence-manifest-binding-verify"
        ]
      },
      "edge_id": "edge-008",
      "edge_type": "SUPPORTED_BY",
      "from_node": "decision-envelope-001",
      "to_node": "evidence-manifest-001"
    },
    {
      "derived_from": {
        "source_artifact_ids": [
          "evidence-manifest-v0.4"
        ],
        "verifier_result_ids": [
          "evidence-manifest-binding-verify"
        ]
      },
      "edge_id": "edge-009",
      "edge_type": "CONTAINS",
      "from_node": "evidence-manifest-001",
      "to_node": "evidence-item-001"
    },
    {
      "derived_from": {
        "source_artifact_ids": [
          "verification-bundle-v0.5",
          "approved-decision-envelope-v0.3"
        ],
        "verifier_result_ids": [
          "ledger-bundle-verify"
        ]
      },
      "edge_id": "edge-010",
      "edge_type": "CONTAINS",
      "from_node": "verification-bundle-001",
      "to_node": "decision-envelope-001"
    },
    {
      "derived_from": {
        "source_artifact_ids": [
          "verification-bundle-v0.5",
          "approval-token-v0.3"
        ],
        "verifier_result_ids": [
          "ledger-bundle-verify"
        ]
      },
      "edge_id": "edge-011",
      "edge_type": "CONTAINS",
      "from_node": "verification-bundle-001",
      "to_node": "approval-token-001"
    },
    {
      "derived_from": {
        "source_artifact_ids": [
          "verification-bundle-v0.5",
          "evidence-manifest-v0.4"
        ],
        "verifier_result_ids": [
          "ledger-bundle-verify"
        ]
      },
      "edge_id": "edge-012",
      "edge_type": "CONTAINS",
      "from_node": "verification-bundle-001",
      "to_node": "evidence-manifest-001"
    },
    {
      "derived_from": {
        "source_artifact_ids": [
          "verification-bundle-v0.5"
        ],
        "verifier_result_ids": [
          "ledger-bundle-verify"
        ]
      },
      "edge_id": "edge-013",
      "edge_type": "VERIFIED_BY",
      "from_node": "verification-bundle-001",
      "to_node": "verifier-result-001"
    },
    {
      "derived_from": {
        "source_artifact_ids": [
          "verification-receipt-v0.6",
          "verification-bundle-v0.5"
        ],
        "verifier_result_ids": [
          "verification-receipt-verify"
        ]
      },
      "edge_id": "edge-014",
      "edge_type": "RECEIPT_FOR",
      "from_node": "verification-receipt-001",
      "to_node": "verification-bundle-001"
    },
    {
      "derived_from": {
        "source_artifact_ids": [
          "verification-receipt-v0.6",
          "receipt-index-v0.7"
        ],
        "verifier_result_ids": [
          "receipt-index-verify"
        ]
      },
      "edge_id": "edge-015",
      "edge_type": "INDEXED_IN",
      "from_node": "verification-receipt-001",
      "to_node": "receipt-index-001"
    },
    {
      "derived_from": {
        "source_artifact_ids": [
          "local-verifier-ui-v0.8"
        ],
        "verifier_result_ids": [
          "local-verifier-ui-inspection"
        ]
      },
      "edge_id": "edge-016",
      "edge_type": "DISPLAYED_BY",
      "from_node": "verifier-result-001",
      "to_node": "local-verifier-ui-001"
    },
    {
      "derived_from": {
        "source_artifact_ids": [
          "runtime-proposal-v0.9",
          "local-verifier-ui-v0.8"
        ],
        "verifier_result_ids": [
          "runtime-proposal-verify",
          "local-verifier-ui-inspection"
        ]
      },
      "edge_id": "edge-017",
      "edge_type": "DERIVED_FROM",
      "from_node": "local-verifier-ui-001",
      "to_node": "runtime-proposal-001"
    }
  ],
  "graph_hash": "sha256:82dc0d3c11dd8c5767a10910c33440bcdf60be380bf76378ddfe747c4c11c29a",
  "graph_id": "10101010-1010-4010-8010-101010101010",
  "nodes": [
    {
      "label": "Runtime proposal v0.9",
      "node_id": "runtime-proposal-001",
      "node_type": "RuntimeProposal",
      "source_artifact_ids": [
        "runtime-proposal-v0.9"
      ]
    },
    {
      "label": "simulated-coding-agent",
      "node_id": "agent-001",
      "node_type": "Agent",
      "source_artifact_ids": [
        "runtime-proposal-v0.9"
      ]
    },
    {
      "label": "PRODUCTION_STATE_CHANGE / NOT_EXECUTED / REQUIRES_GOVERNANCE",
      "node_id": "consequence-001",
      "node_type": "Consequence",
      "source_artifact_ids": [
        "runtime-proposal-v0.9"
      ]
    },
    {
      "label": "Approved decision envelope v0.3",
      "node_id": "decision-envelope-001",
      "node_type": "DecisionEnvelope",
      "source_artifact_ids": [
        "approved-decision-envelope-v0.3"
      ]
    },
    {
      "label": "Approval token v0.3",
      "node_id": "approval-token-001",
      "node_type": "ApprovalToken",
      "source_artifact_ids": [
        "approval-token-v0.3"
      ]
    },
    {
      "label": "Reviewer authority manifest v0.3",
      "node_id": "reviewer-authority-001",
      "node_type": "ReviewerAuthorityManifest",
      "source_artifact_ids": [
        "reviewer-authority-manifest-v0.3"
      ]
    },
    {
      "label": "Evidence manifest v0.4",
      "node_id": "evidence-manifest-001",
      "node_type": "EvidenceManifest",
      "source_artifact_ids": [
        "evidence-manifest-v0.4"
      ]
    },
    {
      "label": "Admitted evidence item from evidence manifest",
      "node_id": "evidence-item-001",
      "node_type": "EvidenceItem",
      "source_artifact_ids": [
        "evidence-manifest-v0.4"
      ]
    },
    {
      "label": "Portable verification bundle v0.5",
      "node_id": "verification-bundle-001",
      "node_type": "VerificationBundle",
      "source_artifact_ids": [
        "verification-bundle-v0.5"
      ]
    },
    {
      "label": "Verification receipt v0.6",
      "node_id": "verification-receipt-001",
      "node_type": "VerificationReceipt",
      "source_artifact_ids": [
        "verification-receipt-v0.6"
      ]
    },
    {
      "label": "Verification receipt index v0.7",
      "node_id": "receipt-index-001",
      "node_type": "ReceiptIndex",
      "source_artifact_ids": [
        "receipt-index-v0.7"
      ]
    },
    {
      "label": "Approved local verifier result set",
      "node_id": "verifier-result-001",
      "node_type": "VerifierResult",
      "source_artifact_ids": [
        "verification-bundle-v0.5",
        "verification-receipt-v0.6",
        "receipt-index-v0.7"
      ]
    },
    {
      "label": "Local verifier UI v0.8",
      "node_id": "local-verifier-ui-001",
      "node_type": "LocalVerifierUI",
      "source_artifact_ids": [
        "local-verifier-ui-v0.8"
      ]
    }
  ],
  "proof_boundary": {
    "does_not_prove": [
      "production custody",
      "external identity",
      "legal admissibility",
      "regulatory compliance",
      "real-world evidence truth",
      "execution safety",
      "hosted product readiness",
      "RAG correctness",
      "retrieval quality",
      "graph database production readiness",
      "ontology completeness",
      "external notarization",